,Unnamed: 0,id,title,body,link,rating,verified_purchase,helpful_votes,year,month,version,bd_cleaned,sw_removed,stemmed
0,0,R22L770J97II2V,Works Great,Have one on all my TVs. These work great,https://www.amazon.com/gp/customer-reviews/R22L770J97II2V/ref=cm_cr_arp_d_rvw_ttl?ie=UTF8&ASIN=B08G9TJWW9,5,True,,2022,2,O.S.10.5,have one on all my tvs these work great,one tvs work great,one tv work great
1,1,R1MP323KTI5HQ6,Para venezuela no permite gran parte de los canales,Para venezuela no permite gran parte de los canales,https://www.amazon.com/gp/customer-reviews/R1MP323KTI5HQ6/ref=cm_cr_arp_d_rvw_ttl?ie=UTF8&ASIN=B08G9TJWW9,3,True,,2022,2,O.S.10.5,i currently have a roku connected to my rca white red yellow compatible television the roku device is entering obsoletion and no longer supported by some channels like amazon i was hoping to get the roku ultra to work by using an hdmi to rca cable but the device would not transmit a visual signal to my tv the lights on the roku ulta were very responsive to the remote so i assume the device would have worked on an hdmi tv in case you re wondering i m not throwing away a good tube television from if anyone knows a method i missed to make this work please share,currently connected rca white red yellow compatible television device entering obsoletion longer supported channels like hoping get ultra work using hdmi rca cable device would transmit visual signal lights ulta responsive remote assume device would worked hdmi case wondering throwing away good tube television anyone knows method missed make work please share,current connect rca white red yellow compat televis devic enter obsolet longer support channel like hope get ultra work use hdmi rca cabl devic would transmit visual signal light ulta respons remot assum devic would work hdmi case wonder throw away good tube televis anyon know method miss make work pleas share
2,2,R3GB0L16XU6TVM,Roku Ultra Cannot Downshift to from HDMI to RCA with adapters,"I currently have a Roku 2 connected to my RCA (white, red, yellow) compatible television. The Roku 2 device is entering obsoletion and no longer supported by some channels, like Amazon. I was ""hoping"" to get the Roku Ultra to work by using an HDMI to RCA cable, but the device would not transmit a visual signal to my TV. The lights on the Roku Ulta were very responsive to the remote, so I assume the device would have worked on an HDMI TV. In case you're wondering, I'm not throwing away a good 36"" tube television from 2006! :-) If anyone knows a method I missed to make this work, please share.",https://www.amazon.com/gp/customer-reviews/R3GB0L16XU6TVM/ref=cm_cr_arp_d_rvw_ttl?ie=UTF8&ASIN=B08G9TJWW9,3,False,,2022,2,O.S.10.5,this will boot up but has a difficult time connecting to the remote mot of the time it won t it also has to be rebooted more than once to get the audio to work correctly i tried multiple new removes still doesn t work do not buy the roku ultra buy only the basic,boot difficult time connecting remote mot time also rebooted get audio work correctly tried multiple new removes still work buy ultra buy basic,boot difficult time connect remot mot time also reboot get audio work correctli tri multipl new remov still work buy ultra buy basic
3,3,RSVLH2L5597IT,Does not work as designed,This will boot up but has a difficult time connecting to the remote. Mot of the time it won't. It also has to be rebooted more than once to get the audio to work correctly. I tried multiple new removes still doesn't work. DO NOT buy the ROKU Ultra. Buy only the basic!,https://www.amazon.com/gp/customer-reviews/RSVLH2L5597IT/ref=cm_cr_arp_d_rvw_ttl?ie=UTF8&ASIN=B08G9TJWW9,1,True,,2022,2,O.S.10.5,i am satisfied with this product as it allows me to view all the programs i wish to easily i did note that after i purchased it shortly before christmas roku put it on sale for less than half the price i think i ll wait to check for sales at holiday times otherwise i am definitely happy with it,satisfied product allows view programs wish easily note purchased shortly christmas put sale less half price think wait check sales holiday times otherwise definitely happy,satisfi product allow view program wish easili note purchas shortli christma put sale less half price think wait check sale holiday time otherwis definit happi
4,4,R2MB38NK8FFMHN,Great product!,"I am satisfied with this product as it allows me to view all the programs I wish to easily. I did note that after I purchased it, shortly before Christmas, ROKU put it on sale for less than half the price! I think I'll wait to check for sales at holiday times. Otherwise, I am definitely happy with it.",https://www.amazon.com/gp/customer-reviews/R2MB38NK8FFMHN/ref=cm_cr_arp_d_rvw_ttl?ie=UTF8&ASIN=B08G9TJWW9,5,True,,2022,2,O.S.10.5,when you hit the power button to turn off the device it will never turn off and once the tv is back activated the picture will be totally zoomed in and the only way to get the right crop back is to go through the tons of menus to restart the device with all these problems noted they should have made it easy to restart the roku without having to suffer through menus of hell it be better to use tv usb power i used the power adapter one star the roku built in tcl tvs are better,hit power button turn device never turn back activated picture totally zoomed way get right crop back go tons menus restart device problems noted made easy restart without suffer menus hell better use usb power used power adapter one star built tcl tvs better,hit power button turn devic never turn back activ pictur total zoom way get right crop back go ton menu restart devic problem note made easi restart without suffer menu hell better use usb power use power adapt one star built tcl tv better
5,5,R3BEB66EHZ4GXV,They Dont Tell You This In The Description,When you hit the POWER button to turn off the device it will never turn off and once the tv is back activated the picture will be totally zoomed in and the only way to get the right crop back is to go through the tons of menus to restart the device. with all these problems noted they should have made it easy to restart the ROKU without having to suffer through menus of hell. It 05be better to use tv usb power i used the power adapter. One star the Roku built in TCL tvs are better.,https://www.amazon.com/gp/customer-reviews/R3BEB66EHZ4GXV/ref=cm_cr_arp_d_rvw_ttl?ie=UTF8&ASIN=B08G9TJWW9,2,True,,2022,2,O.S.10.5,cut the chord on cable tv the roku live tv gives hundreds of free channels that are usually on cable the processor opens and controls apps very fast awesome service wish the remote had lights however most generic remotes are now programmed to work with roku,cut chord cable live gives hundreds free channels usually cable processor opens controls apps fast awesome service wish remote lights however generic remotes programmed work,cut chord cabl live give hundr free channel usual cabl processor open control app fast awesom servic wish remot light howev gener remot program work
6,6,RFXTX0TCFVOTS,Awesome Device,"Cut the chord on cable tv. The Roku live tv gives hundreds of free channels that are usually on cable. The processor opens and controls apps very fast. Awesome service. Wish the remote had lights, however most generic remotes are now programmed to work with Roku",https://www.amazon.com/gp/customer-reviews/RFXTX0TCFVOTS/ref=cm_cr_arp_d_rvw_ttl?ie=UTF8&ASIN=B08G9TJWW9,5,True,,2022,2,O.S.10.5,roku used to play neutral when it comes to streaming tv since they launched their own variation of various services such as showtime for roku there s been nothing but problems this includes complete shows or series missing from their variation of showtime as an example in addition this brand new unit struggles with k streaming on a variety of apps including disney i have gig internet service with basically a business quality network and it s still garbage with frame drops my year old nvidia shield in a variety of other units don t have the same problem this will likely be my last roku,used play neutral comes streaming since launched variation various services showtime nothing problems includes complete shows series missing variation showtime example addition brand new unit struggles k streaming variety apps including disney gig internet service basically business quality network still garbage frame drops year old nvidia shield variety units problem likely last,use play neutral come stream sinc launch variat variou servic showtim noth problem includ complet show seri miss variat showtim exampl addit brand new unit struggl k stream varieti app includ disney gig internet servic basic busi qualiti network still garbag frame drop year old nvidia shield varieti unit problem like last
7,7,R2D1F3LNUJT9MV,Probably last Roku I will own,"Roku used to play neutral when it comes to streaming TV. Since they launched their own variation of various services such as Showtime for Roku, there's been nothing but problems. This includes complete shows or series missing from their variation of Showtime as an example. In addition, this brand new unit struggles with 4K streaming on a variety of apps, including Disney. I have 1. Gig internet service with basically a business quality network and it's still garbage with frame drops. My 6-year-old Nvidia shield in a variety of other units don't have the same problem. This will likely be my last Roku.",https://www.amazon.com/gp/customer-reviews/R2D1F3LNUJT9MV/ref=cm_cr_arp_d_rvw_ttl?ie=UTF8&ASIN=B08G9TJWW9,3,True,,2022,2,O.S.10.5,why did i put off getting one of these i advise you to get one right now you will not regret it excellent interface easy to configure solid build quality it works the remote is right sized and right featured,put getting one advise get one right regret excellent interface easy configure solid build quality works remote right sized right featured,put get one advis get one right regret excel interfac easi configur solid build qualiti work remot right size right featur
8,8,R303QCG9BMZX3X,"Great, love this little thing","Why did I put off getting one of these? I advise you to get one, right now, you will not regret it. Excellent interface. Easy to configure. Solid build quality. It WORKS. The remote is right-sized and right-featured.",https://www.amazon.com/gp/customer-reviews/R303QCG9BMZX3X/ref=cm_cr_arp_d_rvw_ttl?ie=UTF8&ASIN=B08G9TJWW9,5,True,,2022,2,O.S.10.5,got one for my s t tvs they can t get some apps i wanted this gets them all,got one tvs get apps wanted gets,got one tv get app want get
9,9,R36G3O3D5QR16C,Works Great,Got one for my s03t TVs. They can't get some apps I wanted. This gets them all,https://www.amazon.com/gp/customer-reviews/R36G3O3D5QR16C/ref=cm_cr_arp_d_rvw_ttl?ie=UTF8&ASIN=B08G9TJWW9,5,True,,2022,2,O.S.10.5,this product is just what it says and it located jw broadcast instantly and connected to it i have had problems in the past it good to see a product perform as it should,product says located jw broadcast instantly connected problems past good see product perform,product say locat jw broadcast instantli connect problem past good see product perform
10,10,R1NDO345NB5TSX,"Quick connection, perfect picture and excellent performance",This product is just what it says and it located JW Broadcast instantly and connected to it. I have had problems in the past. It good to see a product perform as it should.,https://www.amazon.com/gp/customer-reviews/R1NDO345NB5TSX/ref=cm_cr_arp_d_rvw_ttl?ie=UTF8&ASIN=B08G9TJWW9,5,True,,2022,2,O.S.10.5,i really wanted this to be the upgrade i hoped for from my previous roku but i kept getting an hdcp error screen it indicated i needed to get a better hdmi cable but i was using the one it came with i followed all the help center tips to make this work i switched cables out multiple times i tried every single hdmi outlet on my television i reset and restarted the tv and roku multiple times all ended in the error screen i spent too much time trying to make it work so back to the roku it is,really wanted upgrade hoped previous kept getting hdcp error screen indicated needed get better hdmi cable using one came followed help center tips make work switched cables multiple times tried every single hdmi outlet television reset restarted multiple times ended error screen spent much time trying make work back,realli want upgrad hope previou kept get hdcp error screen indic need get better hdmi cabl use one came follow help center tip make work switch cabl multipl time tri everi singl hdmi outlet televis reset restart multipl time end error screen spent much time tri make work back
11,11,ROB7SF9VQYXOA,I really wanted to like this,"I really wanted this to be the upgrade I hoped for from my previous Roku, but I kept getting an HDCP Error screen. It indicated I needed to get a better HDMI cable, but I was using the one it came with. I followed all the help center tips to make this work, I switched cables out multiple times, I tried every single HDMI outlet on my television, I reset and restarted the TV and Roku multiple times. All ended in the error screen. I spent too much time trying to make it work, so back to the $20 roku it is.",https://www.amazon.com/gp/customer-reviews/ROB7SF9VQYXOA/ref=cm_cr_arp_d_rvw_ttl?ie=UTF8&ASIN=B08G9TJWW9,1,True,,2022,2,O.S.10.5,i bought the roku ultra instead of the apple tv k because it is less than half the price the comparison reviews all had the two devices tied so i thought why not bought it right before super bowl the first half of the super bowl there were constant quick sec wifi drops where you get the wheel from hell but then during the half time show it went down a full minutes my guests were scrambling to other tvs in the house to watch half time while they did that i pulled an apple tv from another part of the house and connected it we didn t lose wifi for the rest of the night only now am i reading the fine print on some reviews where some reviewers do point out that that roku have inferior wifi connection is it worth double the price not to lose wifi in the middle of your favorite show or the super bowl halftime yes i am biting the bullet and buying another apple tv k,bought ultra instead apple k less half price comparison reviews two devices tied thought bought right super bowl first half super bowl constant quick sec wifi drops get wheel hell half time show went full minutes guests scrambling tvs house watch half time pulled apple another part house connected lose wifi rest night reading fine print reviews reviewers point inferior wifi connection worth double price lose wifi middle favorite show super bowl halftime yes biting bullet buying another apple k,bought ultra instead appl k less half price comparison review two devic tie thought bought right super bowl first half super bowl constant quick sec wifi drop get wheel hell half time show went full minut guest scrambl tv hous watch half time pull appl anoth part hous connect lose wifi rest night read fine print review review point inferior wifi connect worth doubl price lose wifi middl favorit show super bowl halftim ye bite bullet buy anoth appl k
12,12,R1EY8OAQGSUXL4,Lost connection during Super Bowl,"I bought the ROKU Ultra instead of the Apple TV 4K because it is less than half the price. The comparison reviews all had the two devices tied so I thought why not. Bought it right before super bowl. The first half of the Super Bowl there were constant quick 7 sec wifi drops where you get the wheel from hell, but then during the half time show it went down a full 3 minutes. My guests were scrambling to other TVs in the house to watch half time. While they did that I pulled an Apple TV from another part of the house and connected it. We didn't lose wifi for the rest of the night. Only now am I reading the fine print on some reviews where some reviewers do point out that that Roku have inferior wifi connection. Is it worth double the price not to lose wifi in the middle of your favorite show or the Super Bowl halftime? Yes. I am biting the bullet and buying another Apple TV 4k.",https://www.amazon.com/gp/customer-reviews/R1EY8OAQGSUXL4/ref=cm_cr_arp_d_rvw_ttl?ie=UTF8&ASIN=B08G9TJWW9,1,True,,2022,2,O.S.10.5,we bought this for two reasons the native android tv o s is poor in comparison we have also have a tcl roku tv that works really well the problem is that we have lost substantial volume vs non roku inputs and the dolby support seems quite limited vs all the dolby options we have through or avr all in all not impressed for a top of the line model as reviews stated this system is showing it s age be we ll get lucky and there will be a software update to address these audio issues video appears to be unaffected,bought two reasons native android poor comparison also tcl works really well problem lost substantial volume vs non inputs dolby support seems quite limited vs dolby options avr impressed top line model reviews stated system showing age get lucky software update address audio issues video appears unaffected,bought two reason nativ android poor comparison also tcl work realli well problem lost substanti volum vs non input dolbi support seem quit limit vs dolbi option avr impress top line model review state system show age get lucki softwar updat address audio issu video appear unaffect
13,13,R2Z5WOFVG9I4AP,Audio issues with home theater system....,"We bought this for two reasons; - The native android TV O/S is poor in comparison - We have also have a TCL Roku TV that works really well. The problem is that we have lost substantial volume vs. non Roku inputs and the Dolby support seems quite limited vs. all the Dolby options we have through or AVR. All in all...not impressed for a ""top of the line"" model. As reviews stated, ""...this system is showing it's age..."" 05be we'll get lucky and there will be a software update to address these audio issues. Video appears to be unaffected.",https://www.amazon.com/gp/customer-reviews/R2Z5WOFVG9I4AP/ref=cm_cr_arp_d_rvw_ttl?ie=UTF8&ASIN=B08G9TJWW9,3,True,,2022,2,O.S.10.5,i ve been using roku for many years and have always been satisfied and usually opt for the newest version this version however does not represent an improvement over the recent past for one thing it takes noticeably longer for channels to load and for another the stream gets interrupted and the video stops for a number of seconds before it resumes when i plug my slightly older roku box back in using the same cables the problems totally disappear so i don t think this has anything to do with my system also this is the second new version i ve tried thinking that be the first was just a bad box nope the same problems recurred with the new box so both have been returned and i will happily continue to use what i have,using many years always satisfied usually opt newest version version however represent improvement recent past one thing takes noticeably longer channels load another stream gets interrupted video stops number seconds resumes plug slightly older box back using cables problems totally disappear think anything system also second new version tried thinking first bad box nope problems recurred new box returned happily continue use,use mani year alway satisfi usual opt newest version version howev repres improv recent past one thing take notic longer channel load anoth stream get interrupt video stop number second resum plug slightli older box back use cabl problem total disappear think anyth system also second new version tri think first bad box nope problem recur new box return happili continu use
14,14,R34Q45ISQO8XV3,Not an Improvement,"I've been using Roku for many years and have always been satisfied and usually opt for the newest version. This version, however, does not represent an improvement over the recent past. For one thing, it takes noticeably longer for channels to load and, for another, the stream gets interrupted and the video stops for a number of seconds before it resumes. When I plug my slightly older Roku box back in using the same cables the problems totally disappear so I don't think this has anything to do with my system. Also this is the second ""new"" version I've tried thinking that 05be the first was just a bad box. Nope. The same problems recurred with the new box so both have been returned and I will happily continue to use what I have.",https://www.amazon.com/gp/customer-reviews/R34Q45ISQO8XV3/ref=cm_cr_arp_d_rvw_ttl?ie=UTF8&ASIN=B08G9TJWW9,1,True,,2022,2,O.S.10.5,i liked the ease and simplicity of set up so many more entertainment options than before i can listen to music through the tv now i am not tech savy and behind the learning curve when it comes to sticks tuners or cord cutters roku ultra is a life extender for my tv,liked ease simplicity set many entertainment options listen music tech savy behind learning curve comes sticks tuners cord cutters ultra life extender,like eas simplic set mani entertain option listen music tech savi behind learn curv come stick tuner cord cutter ultra life extend
15,15,R34076W7XP7074,Making the most of Streaming for a Very Affordable Price!,"I liked the ease and simplicity of set up. So many more entertainment options than before. I can listen to music through the TV now. i am not tech savy and behind the learning curve when it comes to ""sticks"", ""tuners""or ""cord cutters"". Roku Ultra is a life extender for my TV.",https://www.amazon.com/gp/customer-reviews/R34076W7XP7074/ref=cm_cr_arp_d_rvw_ttl?ie=UTF8&ASIN=B08G9TJWW9,5,True,,2022,2,O.S.10.5,improved our streaming experienced i like the support for voice commands good job in design,improved streaming experienced like support voice commands good job design,improv stream experienc like support voic command good job design
16,16,R27QTSZREM89AM,Great product for the price,Improved our streaming experienced. I like the support for voice commands. Good job in design.,https://www.amazon.com/gp/customer-reviews/R27QTSZREM89AM/ref=cm_cr_arp_d_rvw_ttl?ie=UTF8&ASIN=B08G9TJWW9,5,True,,2022,2,O.S.10.5,i bought the roku ultra to replace a roku express that had a few annoying characteristics previous models required a very precise angle for the remote to operate the ultra definitely improves on that issue the remote also has an integrated headphone jack although i don t use that feature i returned the first ultra that i received because it displayed error messages on startup the replacement one does the same thing displaying no cable connected on startup with instructions to check connections or press source when i disregard the instructions and press ok it goes to a second error message saying no power for a couple of seconds and then changes to a normal startup screen which is exactly what the first one did this happens every time i turn it on but once i get past the error messages only takes about seconds it works great and responds much more quickly than the roku express that i previously owned i can live with the startup bug for the improved performance,bought ultra replace express annoying characteristics previous models required precise angle remote operate ultra definitely improves issue remote also integrated headphone jack although use feature returned first ultra received displayed error messages startup replacement one thing displaying cable connected startup instructions check connections press source disregard instructions press ok goes second error message saying power couple seconds changes normal startup screen exactly first one happens every time turn get past error messages takes seconds works great responds much quickly express previously owned live startup bug improved performance,bought ultra replac express annoy characterist previou model requir precis angl remot oper ultra definit improv issu remot also integr headphon jack although use featur return first ultra receiv display error messag startup replac one thing display cabl connect startup instruct check connect press sourc disregard instruct press ok goe second error messag say power coupl second chang normal startup screen exactli first one happen everi time turn get past error messag take second work great respond much quickli express previous own live startup bug improv perform
