,Unnamed: 0,id,title,body,link,rating,verified_purchase,helpful_votes,year,month,version,bd_cleaned,sw_removed,stemmed
323,323,R2EYHGAMILHQ4R,Got rid of Direct Tv,I am saving more than $200/month. It is very simple to use. I have more channels to watch.,https://www.amazon.com/gp/customer-reviews/R2EYHGAMILHQ4R/ref=cm_cr_arp_d_rvw_ttl?ie=UTF8&ASIN=B08G9TJWW9,5,True,,2021,11,O.S.10.5,i ve used fire sticks even k editions built in s t tv functions chromecasts apple tv devices and old even roku devices roku is still my favorite especially this one the killer features that set this one apart are button on base unit that makes the remote beep to help find it headphone jack in the remote for private audio and offline support we lose our remotes regularly fire stick or roku so this first note has easily become our favorite feature of all time and table stakes for any new streaming device we bring into the house since we also tend to group together in the family room the kids playing nicely with toys on the ground someone else on a conference call on their laptop and now i can still watch tv without disturbing anyone else plugging headphones into the mm jack in the side of the remote disables audio that gets output through hdmi finally when our isp has issues but our home wifi still works roku allows us to still stream in home via plex and other no internet options this was a very unexpected and unpleasant surprise we found with our fire sticks internet outage is something for which we have contingencies but it helps to have a platform that actually supports those contingencies too,used fire sticks even k editions built functions chromecasts apple devices old even devices still favorite especially one killer features set one apart button base unit makes remote beep help find headphone jack remote private audio offline support lose remotes regularly fire stick first note easily become favorite feature time table stakes new streaming device bring house since also tend group together family room kids playing nicely toys ground someone else conference call laptop still watch without disturbing anyone else plugging headphones mm jack side remote disables audio gets output hdmi finally isp issues home wifi still works allows us still stream home via plex internet options unexpected unpleasant surprise found fire sticks internet outage something contingencies helps platform actually supports contingencies,use fire stick even k edit built function chromecast appl devic old even devic still favorit especi one killer featur set one apart button base unit make remot beep help find headphon jack remot privat audio offlin support lose remot regularli fire stick first note easili becom favorit featur time tabl stake new stream devic bring hous sinc also tend group togeth famili room kid play nice toy ground someon els confer call laptop still watch without disturb anyon els plug headphon mm jack side remot disabl audio get output hdmi final isp issu home wifi still work allow us still stream home via plex internet option unexpect unpleas surpris found fire stick internet outag someth conting help platform actual support conting
324,324,R2NDXVLHD2EE80,Best streaming device!!!,"Best streaming device on the 03ket!! Fast, direct Ethernet connection. Excellent 4K, UHD Picture of any streaming device I've used! AWESOME!!",https://www.amazon.com/gp/customer-reviews/R2NDXVLHD2EE80/ref=cm_cr_arp_d_rvw_ttl?ie=UTF8&ASIN=B08G9TJWW9,5,True,,2021,11,O.S.10.5,works well and interface is easy to use would recommend to anyone looking to steam tv programs,works well interface easy use would recommend anyone looking steam programs,work well interfac easi use would recommend anyon look steam program
325,325,RY5JFT41PWLDH,A Mixed Bag,"I've used Rokus for as long as I've been streaming, which has been a good number of years. I started with the Roku 2 I think it was called, it only streamed in 720p, but I was happy with it, and was happy with the two Roku 3's I had before this unit. Problem is, I like to record some of the movies I pay for (using a splitter) but it was always frustrating that everything was in DD+ and I needed DD5.1. Well, this unit provides that. Everything I record with my Colossus is 6 channel now. BUT - I am not the first to complain about audio drop-outs. Complaints are all over the web. Can't Roku come out with a simple firmware fix for this irritating problem. This is supposed to be the Cadillac of Rokus, and they can't provide consistant audio streams. They need to stop focusing on how many channels they can sell to rake in the coin, and fix some of these little problems first. I'm sure they have an intern or two that could fix the problem - it's not rocket science.",https://www.amazon.com/gp/customer-reviews/RY5JFT41PWLDH/ref=cm_cr_arp_d_rvw_ttl?ie=UTF8&ASIN=B08G9TJWW9,4,True,2.0,2021,11,O.S.10.5,everyday it makes a constant screeching noise until i reboot the roku device it sometimes scares my kids in their sleep,everyday makes constant screeching noise reboot device sometimes scares kids sleep,everyday make constant screech nois reboot devic sometim scare kid sleep
326,326,R3I7DU6C5CQL5B,WORTH EVERY PENNY!! Finally Live NFL games in perfect quality,being new to streaming only we started with the Roku Express which is a value for only $20. After getting very comfortable with the Roku platform and 12iding this was the permanent replacement over cable we put the Express in the bedroom and purchased the Ultra. Wow! all of the streaming quality issues with the Express are non existent with the Ultra BEST PURCHASE FOR STREAMING QUALITY WE HAVE EVER MADE!!!,https://www.amazon.com/gp/customer-reviews/R3I7DU6C5CQL5B/ref=cm_cr_arp_d_rvw_ttl?ie=UTF8&ASIN=B08G9TJWW9,5,True,2.0,2021,11,O.S.10.5,when i turn roku on i have to unplug and replug the power cord in order for it to work if i pause a show for a little too long i have to unplug and replug in order for it to resume working unfortunately my window of return has closed as i was out of town for a family emergency and could not return it in the limited amount of time they give you to return it i will not purchase another roku product,turn unplug replug power cord order work pause show little long unplug replug order resume working unfortunately window return closed town family emergency could return limited amount time give return purchase another product,turn unplug replug power cord order work paus show littl long unplug replug order resum work unfortun window return close town famili emerg could return limit amount time give return purchas anoth product
327,327,R33VN0EFSN11ZY,Voice Command and Remote Special Keys  can't be used  out of the states,"I got this Roku Ultra for the voice commands and special programmable key in the remote to find out that neither work out of the states. Nothing about this limitation if Roku's website. Roku's customer service seems to be a collection of bots, it took them 6 emails to identify the problem and when they finally did, they refused to take responsibility and sent me to the retailer.",https://www.amazon.com/gp/customer-reviews/R33VN0EFSN11ZY/ref=cm_cr_arp_d_rvw_ttl?ie=UTF8&ASIN=B08G9TJWW9,1,True,,2021,11,O.S.10.5,the roku i recieved had an account already logged in it was used not new as discribed shame amazon,recieved account already logged used new discribed shame,reciev account alreadi log use new discrib shame
328,328,R3RUFAADV1KORU,Remote has fatal design flaw,"I love Roku but the remote on this unit has a fatal design flaw - the remote ""mute"" button is on the side and you CANNOT pick up the remote w/out accidentally pushing the mute button. Aggravating as heck.",https://www.amazon.com/gp/customer-reviews/R3RUFAADV1KORU/ref=cm_cr_arp_d_rvw_ttl?ie=UTF8&ASIN=B08G9TJWW9,3,False,,2021,11,O.S.10.5,this device bricked itself exactly year to the day after purchase too expensive to have to replace every year when it did work it was great,device bricked exactly year day purchase expensive replace every year work great,devic brick exactli year day purchas expens replac everi year work great
329,329,R2RP35OTJ5CV7T,Worst purchase ever,"Barely works, Disney+ and many other platforms don't function and won't play back any video. Only works really with Netflix and Hulu",https://www.amazon.com/gp/customer-reviews/R2RP35OTJ5CV7T/ref=cm_cr_arp_d_rvw_ttl?ie=UTF8&ASIN=B08G9TJWW9,1,False,,2021,11,O.S.10.5,so my roku ultra did not even last months now they want me to eat shipping accept a stick as a replacment are they crazy i would rather switch companies than give them another dime take care of your customers,ultra even last months want eat shipping accept stick replacment crazy would rather switch companies give another dime take care customers,ultra even last month want eat ship accept stick replac crazi would rather switch compani give anoth dime take care custom
330,330,R2QTL6Q9W54BMO,Ultra terrible,"Out of the box this item was a stinker. I'd been using the Amazon 4k stick for some time and seeing as how the Roku Ultra went on sale, coupled with the fact that the Amazon products usually get apps after Roku or had been more buggy in my experience, I 12ided to ""upgrade"". I've had older Roku devices and even a Roku TV that I was perfectly happy with, but there were issues right out of the box with the Ultra that based on other reviews and forum posts, seems to be common with this model. After having used the unit for an evening and having multiple audio drops and dhcp errors, and jumping through all the hoops with different hdmi ports and cables, resets, unplugs, and the like, the unit was boxed up and sent back. My 4k stick might have its issues, but they're no where near as bad as the Roku Ultra. UPDATE- Got a replacement just to ensure I didn't get a lemon and right off the bat there were issues with it connecting to both the wireless and wired networks. Once that issue was resolved, the dhcp issue was still present and on this unit it was actually worse and happened with more frequency than on the one it replaced. I'm done with Roku. As a replacement, I ordered an Apple TV 4K which was more expensive but has been trouble free and exponentially better than the Roku Ultra.",https://www.amazon.com/gp/customer-reviews/R2QTL6Q9W54BMO/ref=cm_cr_arp_d_rvw_ttl?ie=UTF8&ASIN=B08G9TJWW9,1,True,3.0,2021,11,O.S.10.5,had this for about months then unit would boot up with bouncing roku logo and not continue tried several things including reset and went online to find similar issues with others since it was within the warranty period we initiated a warranty exchange one month later still no replacemant and no one responding to us i cannot find a phone number to call very dissapointed,months unit would boot bouncing logo continue tried several things including reset went online find similar issues others since within warranty period initiated warranty exchange one month later still replacemant one responding us cannot find phone number call dissapointed,month unit would boot bounc logo continu tri sever thing includ reset went onlin find similar issu other sinc within warranti period initi warranti exchang one month later still replacem one respond us cannot find phone number call dissapoint
331,331,R25V0G2A3F5777,This was just a newer model as the Roku Rocks!,What I like is that Roku has been reliable since this is the 4th replacement when the older models had not supported newer streaming protocols.,https://www.amazon.com/gp/customer-reviews/R25V0G2A3F5777/ref=cm_cr_arp_d_rvw_ttl?ie=UTF8&ASIN=B08G9TJWW9,5,True,,2021,11,O.S.10.5,this is one of several roku products i have purchased to keep up with the technology very happy with this streaming devise like the fact it has better wifi connection than my older stick the speed and picture quality both good have purchased two of these so far and will buy again unless there is an updated one in the future a big roku fan,one several products purchased keep technology happy streaming devise like fact better wifi connection older stick speed picture quality good purchased two far buy unless updated one future big fan,one sever product purchas keep technolog happi stream devis like fact better wifi connect older stick speed pictur qualiti good purchas two far buy unless updat one futur big fan
332,332,R8JFHIKF8E9QS,DON'T BUY- Buggy and no customer support,"They know their product has a software issue and refuse to do anything about it. I've been getting and HDCP error code every time I try to stream something. I've tried every solution so they escalated the ticket but I've been waiting 10 days for a response. When I ask what's taking so long I'm told they're ""investigating"" the issue. In the meantime I can't even use it.",https://www.amazon.com/gp/customer-reviews/R8JFHIKF8E9QS/ref=cm_cr_arp_d_rvw_ttl?ie=UTF8&ASIN=B08G9TJWW9,1,True,3.0,2021,11,O.S.10.5,like this streaming device only thing i do not like it has no number pad to change channel but minor inconvenience and would be nice if it was back lite at night or dark room and would be grate if they had one with dvr built in that would be awesome,like streaming device thing like number pad change channel minor inconvenience would nice back lite night dark room would grate one dvr built would awesome,like stream devic thing like number pad chang channel minor inconveni would nice back lite night dark room would grate one dvr built would awesom
333,333,R17Z3S8LUQAGL8,Great interface,I have two ROKU TVs. My main TV is older and doesn’t support Directv streaming. I have been using an Apple TV. But it doesn’t pause and rewind or fast forward like my ROKU TVs. So I tried the ROKU Ultra. It is great all my TVs work together. I have used the fire sticks at my sons house and in my opinion the ROKU is far superior to the Apple and the Fire Stick. Just easier to use and more features.,https://www.amazon.com/gp/customer-reviews/R17Z3S8LUQAGL8/ref=cm_cr_arp_d_rvw_ttl?ie=UTF8&ASIN=B08G9TJWW9,5,True,2.0,2021,11,O.S.10.5,remote turns the device off but wont turn it on,remote turns device wont turn,remot turn devic wont turn
334,334,R16IAILC6LYFVR,"Works fine, but","Did not like the menu much. Slow loading. Nothing wrong with it, but I switched to the Nvidia which is way better.",https://www.amazon.com/gp/customer-reviews/R16IAILC6LYFVR/ref=cm_cr_arp_d_rvw_ttl?ie=UTF8&ASIN=B08G9TJWW9,3,True,,2021,11,O.S.10.5,got this on th and this past week it s started throwing hdcp errors powering itself off indiscriminately i replaced the hdcp hdmi cord three times did all the steps the roku site said to and it s still happening every day why bother with the ultra when it doesn t even last a year we got the express versions for the kid s rooms and they re just fine still and good luck getting support from roku they lead you to their support page where you only have options for issues and none of them our product is failing ofc and they give no option for chat speaking with to someone or support email address just flush your money down the toilet or buy something better but avoid roku ultra not worth any money let alone the extra you pay for the ultra,got th past week started throwing hdcp errors powering indiscriminately replaced hdcp hdmi cord three times steps site said still happening every day bother ultra even last year got express versions kid rooms fine still good luck getting support lead support page options issues none product failing ofc give option chat speaking someone support email address flush money toilet buy something better avoid ultra worth money let alone extra pay ultra,got th past week start throw hdcp error power indiscrimin replac hdcp hdmi cord three time step site said still happen everi day bother ultra even last year got express version kid room fine still good luck get support lead support page option issu none product fail ofc give option chat speak someon support email address flush money toilet buy someth better avoid ultra worth money let alon extra pay ultra
335,335,R2EXAZ6B5NLPQZ,I have a s03t TV with most of the channels I typically watch... But I prefer using the Roku instead,"I am a cord cutter and have a s03t TV with all the necessary capabilities (brand rhymes with Zamzung). However, the Roku provides a far better experience in all areas that it makes a worthy add-on for $90. The Roku interface is easier, snappier from a performance perspective, and this just 05 be psychological, but the picture quality seems just a tiny bit better to me. This 05 be attributed to the dedicated hardware of the Roku, I am not sure. It just seems to look better to me (take that with a grain of salt). The remote is also a much better device than the TV remote. The killer features are the shortcut keys at bottom for items such as Hulu and NetFlix, and the voice search in YouTube is MUCH better than the TV voice function. Add to the above Roku's excellent interface, the much larger number of channels, and the remote controls the TV as well, the TV stays on the Roku input full-time now and controls everything.",https://www.amazon.com/gp/customer-reviews/R2EXAZ6B5NLPQZ/ref=cm_cr_arp_d_rvw_ttl?ie=UTF8&ASIN=B08G9TJWW9,5,True,,2021,11,O.S.10.5,upgraded to this ruku to replace a firestick i ve had for several years i must say the performance of this ruku is fantastic the reception speed and easy set up to control the power and volume of my tv is great i am a bit disappointed of the size of the unit i have an outdoor tv with a secure cabinet in the back this ruku devise is too large to fit inside i found a secure way to place it on the outside but know the elements will eventually break it the price is reasonable and will be happy if it lasts a couple of years,upgraded ruku replace firestick several years must say performance ruku fantastic reception speed easy set control power volume great bit disappointed size unit outdoor secure cabinet back ruku devise large fit inside found secure way place outside know elements eventually break price reasonable happy lasts couple years,upgrad ruku replac firestick sever year must say perform ruku fantast recept speed easi set control power volum great bit disappoint size unit outdoor secur cabinet back ruku devis larg fit insid found secur way place outsid know element eventu break price reason happi last coupl year
336,336,RPNT8DHLKLT3P,"Great Device, bunk HDMI cable","The Roku device is wonderful. Upscales everything to Dolby vision or HDR and 4K, yielding really great quality even on streams from Hulu or YouTube that are not natively 4K. Very responsive feedback and menus, a great upgrade for those still struggling with slow built-in S03t TV devices. The only reason I give it four stars is because the cable provided that is labeled as a ""premium"" cable is not able to support Dolby Vision. I spent 20 minutes trying to make sure settings on my TV were correct because while Roku detection determined that my TV and its box supported 4K Dolby Vision streaming, it would not work at all. It was only once I swapped over to an Amazon Basics HDMI cable that I had sitting around that I was finally able to get the TV and Roku to output 4K Dolby Vision. It's a bit infuriating that the provided Cable in the box would not support protocols that the box was able to output.",https://www.amazon.com/gp/customer-reviews/RPNT8DHLKLT3P/ref=cm_cr_arp_d_rvw_ttl?ie=UTF8&ASIN=B08G9TJWW9,4,True,3.0,2021,11,O.S.10.5,i purchased this roku ultra because my fire tv cube has been lagging in response and launching apps i was waiting for an opportunity to purchase my roku when it was on sale luckily i earned an amazon gift card from honey and only paid for my roku ultra i must say that it does not disappoint i notice an improvement in k resolution as well as response and launch of apps starts much faster than fire tv cube thanks to the amazing quad core processor and os apps open quickly as they should with no lag and i m enjoying dolby vision hdr and as soon as i upgrade my a v receiver i ll be enjoying dolby atmos as well set up was so easy this device is definitely worth the purchase i m glad and very satisfied with my purchase and recommend it,purchased ultra fire cube lagging response launching apps waiting opportunity purchase sale luckily earned gift card honey paid ultra must say disappoint notice improvement k resolution well response launch apps starts much faster fire cube thanks amazing quad core processor os apps open quickly lag enjoying dolby vision hdr soon upgrade v receiver enjoying dolby atmos well set easy device definitely worth purchase glad satisfied purchase recommend,purchas ultra fire cube lag respons launch app wait opportun purchas sale luckili earn gift card honey paid ultra must say disappoint notic improv k resolut well respons launch app start much faster fire cube thank amaz quad core processor os app open quickli lag enjoy dolbi vision hdr soon upgrad v receiv enjoy dolbi atmo well set easi devic definit worth purchas glad satisfi purchas recommend
337,337,R10LTNGDJVD5S5,Firestick kills Roku,"I had a Roku when I started looking into get rid of cable but never used it.I then got introduced to the Firestick and been using it ever since.Well my mom and stepdad 12ided to get rid of cable and get into the steaming thing.So I went to Best Buy and asked them which one is better and they said Roku was.So I got it back to my mom and stepdad and went to hook it up.Could not get it past the language section and I had to unplug and replies it back in.Then I had to give them my Email address(well actually my brother was the one doing everything but I was helping).So we gave it my brother address.Then it asked waht room was this for and I was like what the hell?I hav never been asked this on firestick.So then,when we went to proceed and before we could go further, we had to give them a credit card number.I yanked it out of the tv and told my brother to take it back to Best Buy and get his money back and gave my mom and stepdad a extra Friestick.Roku sucks and I dont know anyone who ones one.I will never get a Roku.Firestick all the way.",https://www.amazon.com/gp/customer-reviews/R10LTNGDJVD5S5/ref=cm_cr_arp_d_rvw_ttl?ie=UTF8&ASIN=B08G9TJWW9,1,False,,2021,11,O.S.10.5,the media could not be loaded,media could loaded,media could load
338,338,R1B2EG4SMG8UVE,Replacing my first Ultra that was damaged in a storm,This model is 4K where my original Ultra was not. Picture looks great but the volume control on the side of the remote is in the wrong place for my hand. I accidentally press the volume buttons when I am trying to do something else.,https://www.amazon.com/gp/customer-reviews/R1B2EG4SMG8UVE/ref=cm_cr_arp_d_rvw_ttl?ie=UTF8&ASIN=B08G9TJWW9,5,True,,2021,11,O.S.10.5,bought the roku ultra version to replace my samsung s t k tv of six years as the tv had become too slow and development of new apps was pretty much gone as samsung wants one to buy a new tv since i have switched my tvs in the house as they die to roku tvs i got the roku ultra to use with the samsung in question no complains does everything and does it extremely fast no more annoyance with using samsung with lag and missing apps like apple tv and others i do have some display issues with roku keeping the samsung on k but since the majority of the content i watch is not k its not an issue as i can manually select k from the display setting when needed likely the age of the tv and roku having some talking hand shake issues unlike my older ultra from which had the flashing black screen all the time it seems roku fixed the issue on the models for any user using a bose cinemate make sure you have an optical cable and do not connect the roku ultra into the bose console as the hmdi ports on the bose are hdmi which will cause roku to never see your tv as having k i had this issue till i by passed the bose with just using the optical cable for the audio,bought ultra version replace samsung k six years become slow development new apps pretty much gone samsung wants one buy new since switched tvs house die tvs got ultra use samsung question complains everything extremely fast annoyance using samsung lag missing apps like apple others display issues keeping samsung k since majority content watch k issue manually select k display setting needed likely age talking hand shake issues unlike older ultra flashing black screen time seems fixed issue models user using bose cinemate make sure optical cable connect ultra bose console hmdi ports bose hdmi cause never see k issue till passed bose using optical cable audio,bought ultra version replac samsung k six year becom slow develop new app pretti much gone samsung want one buy new sinc switch tv hous die tv got ultra use samsung question complain everyth extrem fast annoy use samsung lag miss app like appl other display issu keep samsung k sinc major content watch k issu manual select k display set need like age talk hand shake issu unlik older ultra flash black screen time seem fix issu model user use bose cinem make sure optic cabl connect ultra bose consol hmdi port bose hdmi caus never see k issu till pass bose use optic cabl audio
339,339,R2518W1GLNH2RS,Quick shipping and awesome gadget,,https://www.amazon.com/gp/customer-reviews/R2518W1GLNH2RS/ref=cm_cr_arp_d_rvw_ttl?ie=UTF8&ASIN=B08G9TJWW9,5,True,,2021,11,O.S.10.5,nothing not to like good features and performance,nothing like good features performance,noth like good featur perform
