,Unnamed: 0,id,title,body,link,rating,verified_purchase,helpful_votes,year,month,version,bd_cleaned,sw_removed,stemmed
137,137,R1XPGEF5JLGMNM,Very nice upgrade,We have had several roku. We needed to replay an older one because it was just too slow at responding between the remote and system. We went with this one because of the higher wifi connectivity. Very please with it and the remote voice ability.,https://www.amazon.com/gp/customer-reviews/R1XPGEF5JLGMNM/ref=cm_cr_arp_d_rvw_ttl?ie=UTF8&ASIN=B08G9TJWW9,5,True,,2022,1,O.S.10.5,just received the roku ultra setup was easy even easier since i already have a roku account connected to a lg k tv the lg can only be updated to webos which only plays youtube netflix prime video and nothing else the roku ultra is snappy in response and plays and loads videos pretty fast it s on par speed and load time with my lg cx oled the roku ultra has a quad core ghz processor which makes a world of a difference in response time and picture quality being the fact the tv is almost years old roku produces a pretty ent picture compared original from the lg interface and the outdated processor the remote works well with voice recognition speech to text love that i can now have preset buttons youtube and hbomax another added plus the roku remote can power on and off the tv and control the volume picked up the roku ultra on sale for plus used a gift card,received ultra setup easy even easier since already account connected lg k lg updated webos plays youtube netflix prime video nothing else ultra snappy response plays loads videos pretty fast par speed load time lg cx oled ultra quad core ghz processor makes world difference response time picture quality fact almost years old produces pretty ent picture compared original lg interface outdated processor remote works well voice recognition speech text love preset buttons youtube hbomax another added plus remote power control volume picked ultra sale plus used gift card,receiv ultra setup easi even easier sinc alreadi account connect lg k lg updat webo play youtub netflix prime video noth els ultra snappi respons play load video pretti fast par speed load time lg cx ole ultra quad core ghz processor make world differ respons time pictur qualiti fact almost year old produc pretti ent pictur compar origin lg interfac outdat processor remot work well voic recognit speech text love preset button youtub hbomax anoth ad plu remot power control volum pick ultra sale plu use gift card
138,138,R3W4HIGH98PK8L,The content you are trying to play is currently unavailable. Please try again later.,"If you 12ide to purchase this and use it for watching Paramount+ or other content with commercials, get used to seeing the title every 15 minutes or so. I'm currently at the point where I have to watch Paramount+ on my phone to get past commercials, then return to the ROKU to watch the shows. VERY ANNOYING!!! I'm going to be returning this and getting a Fire stick or cube, at least the shows consistently play back on those devices.",https://www.amazon.com/gp/customer-reviews/R3W4HIGH98PK8L/ref=cm_cr_arp_d_rvw_ttl?ie=UTF8&ASIN=B08G9TJWW9,2,True,,2022,1,O.S.10.5,don t buy from here this thing won t connect via ethernet or wifi should be ready to right out of the box,buy thing connect via ethernet wifi ready right box,buy thing connect via ethernet wifi readi right box
139,139,RER4U04V8QG9B,Complete garbage!,This thing should never be shipped. Only rarely connects with my router when all of my other devices have great 5g or 2.4g internet. Roku help site is also useless. Keeps telling me I have a DHCP error among other things totally disappointing. I am returning this as soon as possible,https://www.amazon.com/gp/customer-reviews/RER4U04V8QG9B/ref=cm_cr_arp_d_rvw_ttl?ie=UTF8&ASIN=B08G9TJWW9,1,True,,2022,1,O.S.10.5,will not stream paramount constantly gives an overheat message on tv while watching tv,stream paramount constantly gives overheat message watching,stream paramount constantli give overheat messag watch
140,140,RI6LJGRJ5L6WR,Roku Ultra,This product arrived in good condition and promptly. Easy to install and works perfectly. Happy making one of my dumb Tv's and s03t one.,https://www.amazon.com/gp/customer-reviews/RI6LJGRJ5L6WR/ref=cm_cr_arp_d_rvw_ttl?ie=UTF8&ASIN=B08G9TJWW9,5,True,,2022,1,O.S.10.5,better responsiveness than my older roku express the remote is a bonus my older model was difficult to hit reliably with the ir remote even after relocating equipment and replacing batteries,better responsiveness older express remote bonus older model difficult hit reliably ir remote even relocating equipment replacing batteries,better respons older express remot bonu older model difficult hit reliabl ir remot even reloc equip replac batteri
141,141,R3URPFZH0XQM7K,The remote did not work and multiple attempts to contact Roku have gone unanswered.,The remote did not work and multiple attempts to contact Roku have gone unanswered.,https://www.amazon.com/gp/customer-reviews/R3URPFZH0XQM7K/ref=cm_cr_arp_d_rvw_ttl?ie=UTF8&ASIN=B08G9TJWW9,1,True,,2022,1,O.S.10.5,kids love it and makes it easy to watch something,kids love makes easy watch something,kid love make easi watch someth
142,142,R1A0B6THGRTY5V,Great update for an older device,Good price point for the value and works great.,https://www.amazon.com/gp/customer-reviews/R1A0B6THGRTY5V/ref=cm_cr_arp_d_rvw_ttl?ie=UTF8&ASIN=B08G9TJWW9,5,True,,2022,1,O.S.10.5,i dropped directv went with hulu live so i could watch tcm without spending a fortune unfort i had terrible buffering problems after several calls to hulu they told me they had trouble with vizio tvs although mine is only months old my wifi speed is fast the set is close to the router etc i really didn t want to go back to satellite cable so i did a little research ided on this model b c i wanted to use an ethernet cable to connect to the tv to be sure there would be no more buffering problems it was easy to set up easy to learn the system best of all there are no more buffering problems hulu live finally works fine i took off a star b c roku really should include an ethernet cable other than that i m very satisfied,dropped directv went hulu live could watch tcm without spending fortune unfort terrible buffering problems several calls hulu told trouble vizio tvs although mine months old wifi speed fast set close router etc really want go back satellite cable little research ided model b c wanted use ethernet cable connect sure would buffering problems easy set easy learn system best buffering problems hulu live finally works fine took star b c really include ethernet cable satisfied,drop directv went hulu live could watch tcm without spend fortun unfort terribl buffer problem sever call hulu told troubl vizio tv although mine month old wifi speed fast set close router etc realli want go back satellit cabl littl research ide model b c want use ethernet cabl connect sure would buffer problem easi set easi learn system best buffer problem hulu live final work fine took star b c realli includ ethernet cabl satisfi
143,143,R3G0BO37ELZ7TA,Malisimo,"Es malísimo, sonido bajo, gasta las baterias rapido, se congela, aveces no prende o no apaga, y no me hacen reembolso porque no puedo enviarlo. Mejor compren otro modelo.",https://www.amazon.com/gp/customer-reviews/R3G0BO37ELZ7TA/ref=cm_cr_arp_d_rvw_ttl?ie=UTF8&ASIN=B08G9TJWW9,1,True,,2022,1,O.S.10.5,amazon firestick started getting losing connection messages even thou nothing changed so i switched to the roku ultra and wow super fast doesnt lose connection less ads,firestick started getting losing connection messages even thou nothing changed switched ultra wow super fast doesnt lose connection less ads,firestick start get lose connect messag even thou noth chang switch ultra wow super fast doesnt lose connect less ad
144,144,R2MKEDG9IUYMPW,its better than cable TV for a lot less money,I find it hard to use the remote when trying to select different programs to watch because the Roku remote has the volume control on the side of the remote instead of on the face of the remote where all the other functions reside. When searching with the remote you can't help but hit the volume control causing the volume on the TV to go up or down unintentionally. To me it's not user friendly.,https://www.amazon.com/gp/customer-reviews/R2MKEDG9IUYMPW/ref=cm_cr_arp_d_rvw_ttl?ie=UTF8&ASIN=B08G9TJWW9,4,True,,2022,1,O.S.10.5,hd transmission fast speeds free channels,hd transmission fast speeds free channels,hd transmiss fast speed free channel
145,145,R1FOIM8TD2US4M,Remote already quit working,Love Roku in general but the remote already quit!!,https://www.amazon.com/gp/customer-reviews/R1FOIM8TD2US4M/ref=cm_cr_arp_d_rvw_ttl?ie=UTF8&ASIN=B08G9TJWW9,4,True,,2022,1,O.S.10.5,this is our second roku ultra i ve been surprisingly pleased we bought this for our d hter set up was easy and it has been a great addition for our d hter i definitely recommend purchasing this,second ultra surprisingly pleased bought hter set easy great addition hter definitely recommend purchasing,second ultra surprisingli pleas bought hter set easi great addit hter definit recommend purchas
146,146,R28ZK584VJK4IM,Pretty good,"Overall it worked 12ent. I've had a lot of rokus, but for some reason this one had the most problems. It cuts out hdmi with an error message occassionally, usually when viewing 4k. Roku support was unable to help, perhaps a unit defect.",https://www.amazon.com/gp/customer-reviews/R28ZK584VJK4IM/ref=cm_cr_arp_d_rvw_ttl?ie=UTF8&ASIN=B08G9TJWW9,4,True,,2022,1,O.S.10.5,roku remotes and menus blow away that overpriced apple crap i m an apple fan but their apple tv device and remote is simply garbage roku beats them at streaming and also plays apple tv programs as well as streams from apple devices via airplay by far better than apple tv especially the remote,remotes menus blow away overpriced apple crap apple fan apple device remote simply garbage beats streaming also plays apple programs well streams apple devices via airplay far better apple especially remote,remot menu blow away overpr appl crap appl fan appl devic remot simpli garbag beat stream also play appl program well stream appl devic via airplay far better appl especi remot
147,147,R2H5OJUUUE1YB8,Easy to Setup,This is the only device which gives me a way to use headphones on my older TV. My over the head headphones plug into the remote and intercept the sound from the TV so that I can watch Roku programs quietly at night. I have a semi-s03t TV which lacked several channels not available on Roku.,https://www.amazon.com/gp/customer-reviews/R2H5OJUUUE1YB8/ref=cm_cr_arp_d_rvw_ttl?ie=UTF8&ASIN=B08G9TJWW9,5,True,,2022,1,O.S.10.5,this is about the th roku i have had and it is the worst one im having audio sync issues and purple screens that can only be fixed by unplugging never had any of those issues before now the remote has developed a mind of it s own it will randomly fast forward pause and play by itself,th worst one im audio sync issues purple screens fixed unplugging never issues remote developed mind randomly fast forward pause play,th worst one im audio sync issu purpl screen fix unplug never issu remot develop mind randomli fast forward paus play
148,148,R2P5YTUF2TKRPP,First day worked fine.,The first day it worked fine. Now it's day two and I'm having issues. It just buffers and doesn't play.,https://www.amazon.com/gp/customer-reviews/R2P5YTUF2TKRPP/ref=cm_cr_arp_d_rvw_ttl?ie=UTF8&ASIN=B08G9TJWW9,3,True,,2022,1,O.S.10.5,chose roku over firestick or other streaming devices due to price point and capabilities such as apple airplay however i feel the display could be better i have a k sony tv and it s pixelated and the color black often doesn t translate well my biggest problem is sometimes which has happened a few times now the roku will randomly loses volume when this happens turning it on and off does nothing you would have to get up and do a complete hard reset to get your volume back which was happening pretty often at one point and i was going to just send it back because of how annoyed i was i have my roku connected via a ethernet cord bought a higher rated hdmi cord just seems good at best nothing more nothing less,chose firestick streaming devices due price point capabilities apple airplay however feel display could better k sony pixelated color black often translate well biggest problem sometimes happened times randomly loses volume happens turning nothing would get complete hard reset get volume back happening pretty often one point going send back annoyed connected via ethernet cord bought higher rated hdmi cord seems good best nothing nothing less,chose firestick stream devic due price point capabl appl airplay howev feel display could better k soni pixel color black often translat well biggest problem sometim happen time randomli lose volum happen turn noth would get complet hard reset get volum back happen pretti often one point go send back annoy connect via ethernet cord bought higher rate hdmi cord seem good best noth noth less
149,149,RVWFPQ8PO6SSE,Easy and fantastic!,"Such an easy streaming device, it made our lives a bit simpler. We have a couple of Roku TVs, so we are used to the interface. Highly recommend.",https://www.amazon.com/gp/customer-reviews/RVWFPQ8PO6SSE/ref=cm_cr_arp_d_rvw_ttl?ie=UTF8&ASIN=B08G9TJWW9,5,True,,2022,1,O.S.10.5,i love how well the roku works the display looks great sound is awesome and it s easy to set up,love well works display looks great sound awesome easy set,love well work display look great sound awesom easi set
150,150,R24S2797WU26Y2,WORTH IT,DOES THE JOB,https://www.amazon.com/gp/customer-reviews/R24S2797WU26Y2/ref=cm_cr_arp_d_rvw_ttl?ie=UTF8&ASIN=B08G9TJWW9,5,True,,2022,1,O.S.10.5,so easy to install easy to use and the image on our t v is way better this was a good purchase,easy install easy use image v way better good purchase,easi instal easi use imag v way better good purchas
151,151,R3L2LBSXDSQAWT,"Good, but does weird things","The product is great and easy to hook up but it turns the Roku on while watching TV and changes input settings at random when it’s not being used, very annoying. We sent it back thinking something was wrong, but the new one does it too",https://www.amazon.com/gp/customer-reviews/R3L2LBSXDSQAWT/ref=cm_cr_arp_d_rvw_ttl?ie=UTF8&ASIN=B08G9TJWW9,4,True,,2022,1,O.S.10.5,worth the money and clarity is unbelievable the xfinity channels are much better than the cable box i strongly recommend it,worth money clarity unbelievable xfinity channels much better cable box strongly recommend,worth money clariti unbeliev xfiniti channel much better cabl box strongli recommend
152,152,RTYVFZOL8FSF3,Batteries supplied were defective.,"Roku was shipped with defective remote batteries. if I had not set everything up, I would return everything. I had to supply my own batteries.",https://www.amazon.com/gp/customer-reviews/RTYVFZOL8FSF3/ref=cm_cr_arp_d_rvw_ttl?ie=UTF8&ASIN=B08G9TJWW9,1,True,,2022,1,O.S.10.5,the controller that came with this device has aa s the sticks and basic controller use aaa kept wondering why i have had to replace batteries in my stick controllers probably times before i ever had to change a battery in this controller plus u can plug in ear buds and it silences the tv great for sleeping next to folks who can t stand noise,controller came device aa sticks basic controller use aaa kept wondering replace batteries stick controllers probably times ever change battery controller plus u plug ear buds silences great sleeping next folks stand noise,control came devic aa stick basic control use aaa kept wonder replac batteri stick control probabl time ever chang batteri control plu u plug ear bud silenc great sleep next folk stand nois
153,153,R334JNJBG0AR41,Brings life back to older LCD TV.  Might be worth setting up on newer TV as well.,"Just received the Roku Ultra. Setup was easy. Even easier since I already have a ROKU account. Connected to a 2015 LG 4K TV. The LG can only be updated to WebOS 2.3, which only plays youtube, Netflix, Prime Video, and nothing else. The ROKU Ultra is snappy in response and plays and loads videos pretty fast. It's on par (speed and load time) with my LG CX OLED. The Roku Ultra has a quad-core 1.2 GHz processor which makes a world of a difference in response time and picture quality. Being the fact the tv is almost 7 years old, Roku produces a pretty 12ent picture compared original from the LG interface and the outdated processor. The remote works well with voice recognition speech to text. Love that I can now have 2 preset buttons ( Youtube and HBOMAX). Another added plus, the Roku remote can power on and off the TV and control the Volume. Picked up the Roku Ultra on sale for $69 plus used a gift card.",https://www.amazon.com/gp/customer-reviews/R334JNJBG0AR41/ref=cm_cr_arp_d_rvw_ttl?ie=UTF8&ASIN=B08G9TJWW9,5,True,,2022,1,O.S.10.5,i have owned many roku devices this is the first one that i continually have to reboot and it buffers constantly we can stream on every other device including our older roku devices,owned many devices first one continually reboot buffers constantly stream every device including older devices,own mani devic first one continu reboot buffer constantli stream everi devic includ older devic
154,154,R1S4LOL6XJI21Q,Defective Unit,Don't buy from here. This thing won't connect via ethernet or wifi. Should be ready to right out of the box,https://www.amazon.com/gp/customer-reviews/R1S4LOL6XJI21Q/ref=cm_cr_arp_d_rvw_ttl?ie=UTF8&ASIN=B08G9TJWW9,1,True,,2022,1,O.S.10.5,purchased to replace cable that is a joke it will be going back it thinks i am in mexico will only speak spanish will not steam paramount no matter what i do there is no language change i am done i will be going to something else,purchased replace cable joke going back thinks mexico speak spanish steam paramount matter language change done going something else,purchas replac cabl joke go back think mexico speak spanish steam paramount matter languag chang done go someth els
155,155,R1ZSMX3V43M4O2,Perfect,It works perfectly,https://www.amazon.com/gp/customer-reviews/R1ZSMX3V43M4O2/ref=cm_cr_arp_d_rvw_ttl?ie=UTF8&ASIN=B08G9TJWW9,5,True,,2022,1,O.S.10.5,upscales video well picture qualiy is really improved worth the cost at this time im running the ultra on p plasma flat screen,upscales video well picture qualiy really improved worth cost time im running ultra p plasma flat screen,upscal video well pictur qualiy realli improv worth cost time im run ultra p plasma flat screen
156,156,RSA9368WAPMDD,OVERHEATS,WILL NOT STREAM PARAMOUNT + . CONSTANTLY GIVES AN OVERHEAT MESSAGE ON TV WHILE WATCHING TV,https://www.amazon.com/gp/customer-reviews/RSA9368WAPMDD/ref=cm_cr_arp_d_rvw_ttl?ie=UTF8&ASIN=B08G9TJWW9,1,False,,2022,1,O.S.10.5,fantastic item and this is my rd purchase however mine came with all the parts on a blister pack previously it came in a nice box i must warn that you ll need large scissors and or a pocket knife to get this open i hope you don t slice your hand open trying to get the parts removed shame on roku for using this dangerous form of packaging that is completely unnecessary,fantastic item rd purchase however mine came parts blister pack previously came nice box must warn need large scissors pocket knife get open hope slice hand open trying get parts removed shame using dangerous form packaging completely unnecessary,fantast item rd purchas howev mine came part blister pack previous came nice box must warn need larg scissor pocket knife get open hope slice hand open tri get part remov shame use danger form packag complet unnecessari
157,157,R3SP1YU7KN1P8S,Upgraded from Roku Express. Love the point-anywhere remote!,"Better responsiveness than my older Roku Express. The remote is a bonus. My older model was difficult to hit reliably with the IR remote, even after relocating equipment and replacing batteries.",https://www.amazon.com/gp/customer-reviews/R3SP1YU7KN1P8S/ref=cm_cr_arp_d_rvw_ttl?ie=UTF8&ASIN=B08G9TJWW9,5,True,,2022,1,O.S.10.5,we have had earlier generation roku boxes which were fine but this new ultra is superb fast multiple processors very clean interface and brilliant to set up and we got it on sale for which was a steal thank you roku,earlier generation boxes fine new ultra superb fast multiple processors clean interface brilliant set got sale steal thank,earlier gener box fine new ultra superb fast multipl processor clean interfac brilliant set got sale steal thank
158,158,R3OJSTKCXH6ZE1,Worked great,Kids love it and makes it easy to watch something,https://www.amazon.com/gp/customer-reviews/R3OJSTKCXH6ZE1/ref=cm_cr_arp_d_rvw_ttl?ie=UTF8&ASIN=B08G9TJWW9,5,True,,2022,1,O.S.10.5,the roku ultra is basically a paper weight the company knowingly put out a product that is not fully compatible with the latest hdmi technology the menu displays just fine but once you try and watch a movie on apple or netflix you get a hdcp error all of the fixes that roku suggests do not work and require you to jump through a bunch of hoops unplug all devices driver updates cable upgrades etc save yourself the headache and do not buy this product,ultra basically paper weight company knowingly put product fully compatible latest hdmi technology menu displays fine try watch movie apple netflix get hdcp error fixes suggests work require jump bunch hoops unplug devices driver updates cable upgrades etc save headache buy product,ultra basic paper weight compani knowingli put product fulli compat latest hdmi technolog menu display fine tri watch movi appl netflix get hdcp error fix suggest work requir jump bunch hoop unplug devic driver updat cabl upgrad etc save headach buy product
159,159,RXUWKQD4X775C,does what i wanted it for,"i dropped directv & went with hulu live so i could watch TCM without spending a fortune...unfort, i had terrible buffering problems. after several calls to hulu, they told me they had trouble with vizio tvs, although mine is only 18 months old, my wifi speed is fast, the set is close to the router, etc. i really didn't want to go back to satellite/cable so i did a little research & 12ided on this model b/c i wanted to use an ethernet cable to connect to the tv to be sure there would be no more buffering problems. it was easy to set up, easy to learn the system & best of all, there are no more buffering problems - hulu live finally works fine. i took off a star b/c roku really should include an ethernet cable. other than that, i'm very satisfied.",https://www.amazon.com/gp/customer-reviews/RXUWKQD4X775C/ref=cm_cr_arp_d_rvw_ttl?ie=UTF8&ASIN=B08G9TJWW9,4,True,,2022,1,O.S.10.5,roku is an excellent product i gave all the features a yet gave the overall rating a how come you ask simple there s a software bug in the ultra that has existed for a couple of years and roku has not yet fixed it basically the roku will change the display type to auto detect no matter what setting you set it to if you have an hdr capable tv that means that the video will simply go to black at random times and the only way to get the video back is to turn the roku off and then on again this is not acceptable and i had to switch to a chromecast with google tv because of it,excellent product gave features yet gave overall rating come ask simple software bug ultra existed couple years yet fixed basically change display type auto detect matter setting set hdr capable means video simply go black random times way get video back turn acceptable switch chromecast google,excel product gave featur yet gave overal rate come ask simpl softwar bug ultra exist coupl year yet fix basic chang display type auto detect matter set set hdr capabl mean video simpli go black random time way get video back turn accept switch chromecast googl
160,160,R33TC6KG42MYTG,Switched from Firestick,"Amazon Firestick started getting losing connection messages, even thou nothing changed. So I switched to the Roku Ultra and Wow!!! Super fast, doesnt lose connection, less ads.",https://www.amazon.com/gp/customer-reviews/R33TC6KG42MYTG/ref=cm_cr_arp_d_rvw_ttl?ie=UTF8&ASIN=B08G9TJWW9,5,True,,2022,1,O.S.10.5,usung private listening from the remote the remote battery drains to in about to days also now after about weeks of use the sound comes out of the remote instead of the ear plugs as it is supposed to returning this one for a replacement to see if a new one will be better,usung private listening remote remote battery drains days also weeks use sound comes remote instead ear plugs supposed returning one replacement see new one better,usung privat listen remot remot batteri drain day also week use sound come remot instead ear plug suppos return one replac see new one better
161,161,R1X4SOI2P41Q6S,Up to date product. easy to use!,Hd transmission. Fast speeds. Free channels!,https://www.amazon.com/gp/customer-reviews/R1X4SOI2P41Q6S/ref=cm_cr_arp_d_rvw_ttl?ie=UTF8&ASIN=B08G9TJWW9,5,True,,2022,1,O.S.10.5,i purchased this to replace my x as the remote for the is no longer working the connectivity with the new k stick was horrible i tried everything following the guides on the roku site i checked my internet connection even though roku said excellent buffer buffer buffer fail fail fail reinstalled my and the problems went away disappointed to say the least returning,purchased replace x remote longer working connectivity new k stick horrible tried everything following guides site checked internet connection even though said excellent buffer buffer buffer fail fail fail reinstalled problems went away disappointed say least returning,purchas replac x remot longer work connect new k stick horribl tri everyth follow guid site check internet connect even though said excel buffer buffer buffer fail fail fail reinstal problem went away disappoint say least return
